{
  "$schema": "urn:convergence:schema:content:v10:manifest",
  "schemaVersion": 10,
  "id": "convergence.clean_battle_demo",
  "version": "0.10.0",
  "displayName": "Clean Battle Demo",
  "dependencies": [
    {
      "id": "convergence.skill_system_redesign_sample",
      "version": "0.10.0"
    }
  ],
  "documents": [
    {
      "type": "races",
      "path": "clean_battle_demo.races.json"
    },
    {
      "type": "skills",
      "path": "clean_battle_demo.skills.json"
    },
    {
      "type": "entities",
      "path": "clean_battle_demo.entities.json"
    }
  ]
}
