{
  "$schema": "urn:convergence:schema:content:v10:manifest",
  "schemaVersion": 10,
  "id": "convergence.training_annex_slice",
  "version": "0.10.0",
  "displayName": "Training Annex Slice",
  "documents": [
    {
      "type": "races",
      "path": "training_annex_slice.races.json"
    },
    {
      "type": "ailments",
      "path": "training_annex_slice.ailments.json"
    },
    {
      "type": "skills",
      "path": "training_annex_slice.skills.json"
    },
    {
      "type": "entities",
      "path": "training_annex_slice.entities.json"
    },
    {
      "type": "items",
      "path": "training_annex_slice.items.json"
    },
    {
      "type": "equipment",
      "path": "training_annex_slice.equipment.json"
    },
    {
      "type": "shops",
      "path": "training_annex_slice.shops.json"
    },
    {
      "type": "negotiations",
      "path": "training_annex_slice.negotiations.json"
    },
    {
      "type": "encounters",
      "path": "training_annex_slice.encounters.json"
    },
    {
      "type": "dungeons",
      "path": "training_annex_slice.dungeons.json"
    },
    {
      "type": "fusion",
      "path": "training_annex_slice.fusion.json"
    },
    {
      "type": "rulesets",
      "path": "training_annex_slice.rulesets.json"
    }
  ]
}
